summary_clean,summary_tag
"Safety in Defense Contracting Act - Requires the Secretary of Defense to debar from contracting with the Department of Defense (DOD) any defense contractor: (1) officially determined to have caused serious injury or death to any civilian or military personnel through gross negligence or reckless disregard for safety, or to have committed fraud; or (2) awarded a subcontract to a subcontractor officially determined to have caused or committed such actions. Directs the Secretary to also debar any subcontractor found to have caused or committed such actions.Requires a five-year minimum period for such a debarment.Authorizes a debarment waiver by the Secretary if it would jeopardize national security.Directs the Secretary, in the case of any defense contractor receiving a level III corrective action request from the Defense Contract Management Agency in a fiscal year, to withhold any contract award or incentive fees for that fiscal year.","[{'label': '[no-conn]', 'score': 0.27585986256599426}, {'label': 'further,', 'score': 0.21281298995018005}, {'label': 'accordingly', 'score': 0.1522323489189148}, {'label': 'further,', 'score': 0.16214337944984436}, {'label': 'further,', 'score': 0.31470996141433716}]"
"Health Quality and Fairness Act of 1998 - Amends title XXVII (Assuring Portability, Availability, and Renewability of Health Insurance Coverage) of the Public Health Service Act to establish a new part (Patient Protection Standards) which sets forth health plan standards concerning: (1) notice; (2) coverage; (3) access to emergency care; (4) the doctor-patient relationship; (5) quality assurance; (6) designation of a primary care provider; (7) grievance and appeals procedures; and (8) understandability of information.","[{'label': 'NAN', 'score': 'NAN'}]"
"Social Security Account Number Anti-Fraud Act - Amends title II (Old Age, Survivors and Disability Insurance) (OASDI) of the Social Security Act to direct the Secretary of Health and Human Services to: (1) establish, according to prescribed guidelines, an electronic program for American employers to verify the social security number and other relevant employment information to reduce the use of fraudulent social security documents for employment purposes; (2) implement such program according to a prescribed schedule, making it available to all employers in the States of California, Florida, Illinois, New Jersey, New York, and Texas; and (3) report to the Congress on the Program's initial implementation.","[{'label': 'NAN', 'score': 'NAN'}]"
"This bill directs the Department of the Interior, if the J.R. Simplot Company offers to convey three identified parcels of land, to convey to the Simplot Company two identified parcels of federal land within the Pocatello Field Office of the Bureau of Land Management in Idaho. The bill states that the exchange of such federal and nonfederal lands shall not constitute a major federal action for purposes of the National Environmental Policy Act of 1969.","[{'label': 'specifically,', 'score': 0.7312623858451843}, {'label': 'specifically,', 'score': 0.2925121486186981}]"
"International Remittance Consumer Protection Act of 2004 - Amends the Electronic Fund Transfer Act to require a remittance transfer provider to: (1) clearly and conspicuously make specified disclosures in writing and in a form that the consumer may keep to each consumer requesting a remittance transfer; and (2) make such disclosures in English and in the same languages principally used by the remittance transfer provider, or its agents at that office, if other than English.Prescribes error resolution guidelines and remedies governing remittance transfer errors.Instructs the Secretary of the Treasury to publish electronically on each business day the foreign currencies dollar exchange rate.Subjects a remittance transfer provider to liability for violations committed by its agents or subsidiaries.Amends the Federal Credit Union Act to empower Federal Credit Unions to: (1) provide remittance transfers to persons in the field of membership; and (2) to cash checks and money orders for such persons for a fee.Directs the Board of Governors of the Federal Reserve System to work with the Federal reserve banks to expand the use of the automated clearinghouse system for remittance transfers to foreign countries.Requires certain Federal banking agencies to provide guidelines to financial institutions regarding the offering of low-cost remittance transfers and no-cost or low-cost basic consumer accounts, as well as agency services to remittance transfer providers.Requires such agencies and the Secretary to assist the Financial Literacy and Education Commission in improving the financial literacy and education of consumers who send remittances.","[{'label': 'specifically,', 'score': 0.40532684326171875}, {'label': '[no-conn]', 'score': 0.24091535806655884}, {'label': 'simultaneously', 'score': 0.1717749536037445}, {'label': '[no-conn]', 'score': 0.37005773186683655}, {'label': 'specifically,', 'score': 0.648800253868103}, {'label': 'specifically,', 'score': 0.44116389751434326}, {'label': 'specifically,', 'score': 0.6189269423484802}, {'label': 'specifically,', 'score': 0.35641926527023315}]"
"Marketplace Equity Act of 2011 - Authorizes states to require all sellers making remote sales to collect and remit sales and use taxes with respect to such sales into the state, without regard to the location of the seller, if such states implement a simplified system for administration of sales and use tax collection for remote sellers. Requires such a system to include, at a minimum: (1) an exception for remote sellers with gross annual receipts in the preceding calendar year from remote sales not exceeding $1 million in the United States or not exceeding $100,000 in the state, (2) a single sales and use tax return for use by remote sellers and a single revenue authority within the state with which remote sellers are required to file a tax return, and (3) a uniform tax base throughout the state.Defines ""remote sale"" as a sale of goods or services attributed to a state with respect to which a seller does not have adequate physical presence to establish a nexus so as to allow such state to require such seller to collect and remit taxes.","[{'label': 'accordingly', 'score': 0.11036369949579239}, {'label': 'additionally', 'score': 0.16757717728614807}, {'label': 'accordingly', 'score': 0.15713007748126984}]"
"United Nations Population Fund (UNFPA) Funding Act of 2003 - Authorizes appropriations for FY 2004 and 2005 for U.S. voluntary contributions to the United Nations Population Fund (UNFPA). Withholds from the U.S. voluntary contribution to the UNFPA amounts allocated by UNFPA for the country program in China, if the Secretary of State certifies to the appropriate congressional committees that the UNFPA country program in China does not: (1) focus on improving the delivery of voluntary family planning information and services; (2) conform with the human rights principles affirmed at the International Conference on Population and Development with the support of 180 nations including the United States; (3) operate only in counties of China where all quotas and targets for the recruitment of program participants have been abolished and the use of coercive measures has been eliminated; (4) operate in consultation with and under the oversight and approval of the UNFPA executive board, including the U.S. representative; (5) subject itself to regular, independent monitoring to ensure compliance with the principles of informed consent and voluntary participation; and (6) suspend operations in project counties found to be in violation of program guidelines.","[{'label': '[no-conn]', 'score': 0.300306499004364}, {'label': 'NAN', 'score': 'NAN'}]"
"Tax Crimes and Identity Theft Prevention Act - Requires the Secretary of the Treasury to take necessary action to correct a tax return or tax information affected by the misuse of a taxpayer's identity within 90 days after receiving notice of such misuse from the taxpayer.Amends the Internal Revenue Code to: (1) authorize the Secretary to disclose tax return information to federal, state, and local law enforcement personnel who are personally and directly engaged in the investigation of identity theft; (2) impose a fine and/or prison term on any person who knowingly or willfully misappropriates another person's tax identification number; (3) increase the civil and criminal penalties for improper disclosure or use of tax information by tax return preparers; (4) require the Commissioner of the Internal Revenue Service (IRS) to report to Congress on the number of reported tax fraud cases and on actions taken in response to such reports; and (5) require the head of the Federal Bureau of Prisons to submit to Congress a detailed plan on how it will use tax information provided by the IRS to reduce prison tax fraud.Directs the Secretary to: (1) implement an identity theft tax fraud prevention program that provides for a unique personal identification number (PIN) on tax returns; and (2) review whether current federal tax law prevents the effective enforcement of local, state, and federal identity theft statutes.Authorizes the Commissioner to transfer appropriated funds to be used solely to prevent and resolve potential tax fraud cases.Directs the Commissioner to establish in the Criminal Investigation Division of the IRS the position of Local Law Enforcement Liaison to coordinate the investigation of tax fraud with state and local law enforcement agencies.Directs the Comptroller General to study and report on the role of prepaid debit cards and commercial tax preparation software in facilitating fraudulent tax returns through identity theft.Prohibits the Secretary of Commerce from disclosing information contained on the Death Master File relating to a deceased individual to persons who are not certified to access such information.Authorizes the Attorney General to award grants to state and local law enforcement agencies for the investigation and prosecution of tax crimes.","[{'label': 'generally,', 'score': 0.15753178298473358}, {'label': 'NAN', 'score': 'NAN'}, {'label': 'specifically,', 'score': 0.23021885752677917}, {'label': 'specifically,', 'score': 0.20819413661956787}, {'label': 'specifically,', 'score': 0.21202562749385834}, {'label': 'specifically,', 'score': 0.5193583369255066}, {'label': 'further,', 'score': 0.23864927887916565}, {'label': '[no-conn]', 'score': 0.2104058414697647}]"
"Imagery, Mapping, and Geospatial Enhancement Act of 2006 - Amends the Technology Administration Act of 1998 to include among the functions of the Office of Space Commercialization promoting growth and advancement in U.S. space and airborne remote sensing technologies and related value-added services by: (1) examining the role of, and federal agency use of, commercial remote sensing firms, facilitating a reduction in the use of government remote sensing products and services, and increasing the use of commercial remote sensing firms; (2) promoting the objectives of the U.S. Commercial Remote Sensing Space Policy, particularly provisions on relying on U.S. capabilities and developing a long-term relationship between the government and the U.S. commercial remote sensing community; (3) creating an environment in which all such firms have the opportunity to compete and expand; (4) evaluating federal and private sector efforts to assist such firms and making recommendations to promote their establishment and growth; (5) serving as the focal point for complaints and suggestions concerning federal activities that affect such firms; (6) counseling such firms on government relations; (7) proposing needed changes in federal policies; (8) representing such firms before government agencies; (9) involving such firms in developing federal procurement strategies; (10) disseminating information about the use of remote sensing and the capabilities of such firms; (11) making recommendations to assist the development and strengthening of such firms.","[{'label': 'NAN', 'score': 'NAN'}]"
"Sowing the Seeds Through Science and Engineering Research Act - Authorizes appropriations for FY2007-FY2011 to: (1) the National Science Foundation (NSF), Department of Energy (DOE), National Aeronautics and Space Administration (NASA), and National Institute of Standards and Technology (NIST) for support of basic research activities in the physical sciences, mathematics and computer sciences, and engineering; and (2) the Department of Defense (DOD) for support of basic research activities. Makes at least 8% of such amounts available for high-risk, potentially high-payoff research.Authorizes appropriations for FY2007-FY2011 to the NSF, National Institutes of Health (NIH), DOE, DOD, and NASA for the support of the Presidential Early Career Award for Scientists and Engineers program.Directs NSF to institute the Graduate Scholar Awards in Science, Technology, Engineering, or Mathematics program or GSA-STEM program, to award graduate fellowships in science, technology, engineering, or mathematics. Requires the NSF Director to establish an advisory board.Establishes a Presidential Innovation Award, which the President shall periodically award to individuals who develop one or more unique scientific or engineering ideas in the national interest.Directs the Office of Science and Technology Policy to establish a National Coordination Office for Research Infrastructure to: (1) identify and prioritize deficiencies in research facilities and instrumentation in academic institutions and national laboratories; and (2) make recommendations for resource allocation. Authorizes appropriations for FY2007-FY2011 to NSF and DOE for construction and maintenance of research facilities at institutions of higher education or national laboratories and other physical resources for performing leading-edge research.","[{'label': 'specifically,', 'score': 0.6894343495368958}, {'label': 'third,', 'score': 0.22817222774028778}, {'label': 'additionally', 'score': 0.4066550135612488}, {'label': 'additionally', 'score': 0.21143081784248352}, {'label': 'specifically,', 'score': 0.18975359201431274}, {'label': 'thereafter,', 'score': 0.20544932782649994}, {'label': 'specifically,', 'score': 0.15818071365356445}, {'label': '[no-conn]', 'score': 0.23112989962100983}]"
Home Refinancing Assistance Act of 1993 - Amends the National Housing Act to authorize the Secretary of Housing and Urban Development to insure qualifying single family home refinancings.,"[{'label': 'specifically,', 'score': 0.36346790194511414}]"
Everyone Deserves Unconditional Access to Education (EDUCATE) Act - Amends the Individuals with Disabilities Education Act (IDEA) to reauthorize and make appropriations for the grant program to assist states and outlying areas in providing special education and related services to children with disabilities.Sets the amount to be authorized and the amount to be appropriated for each fiscal year from FY2010-FY2015 as the greater of: (1) a specified amount; or (2) a specified percentage of an amount determined pursuant to a formula that multiplies the number of children receiving special education services by the average per-pupil expenditure in public elementary and secondary schools.Authorizes appropriations for FY2016 and thereafter that equal 40% of the amount determined using such formula. Makes appropriations for FY2016 and thereafter that are determined by subtracting a specified amount from the amount authorized.Requires amounts appropriated to be expended consistent with pay-as-you-go requirements.,"[{'label': 'specifically,', 'score': 0.3072913587093353}, {'label': 'additionally', 'score': 0.2632550299167633}, {'label': 'thereafter,', 'score': 0.43557947874069214}, {'label': 'generally,', 'score': 0.12387766689062119}, {'label': '[no-conn]', 'score': 0.3252950608730316}]"
"Commercial Engagement Through Ocean Technology Act of 2018 or the CENOTE Act of 2018 This bill directs the National Oceanic and Atmospheric Administration (NOAA)to establish a joint program office within the Office of Oceanic and Atmospheric Research and the Office of Marine and Aviation Operations to coordinate the acquisition and assessment of unmanned maritime systems. NOAA must coordinate with the Department of the Navy to leverage expertise in the development and operational transition of unmanned maritime systems. It may also coordinate with other federal agencies, the academic sector, and the private sector to maximize research opportunities and to support commercialization of unmanned maritime systems.","[{'label': 'specifically,', 'score': 0.7030166983604431}, {'label': 'specifically,', 'score': 0.17620106041431427}, {'label': 'further,', 'score': 0.16470082104206085}]"
"Palestinian and United Nations Anti-Terrorism Act of 2014 - States that it shall be U.S. policy to: (1) deny U.S. assistance to any entity or international organization that collaborates with Hamas until Hamas agrees to recognize Israel, renounces violence, disarms, and accepts prior Israeli-Palestinian agreements; (2) seek a negotiated settlement only if Hamas and any U.S.-designated terrorist groups are required to disarm entirely; and (3) provide security assistance to Israel. Considers any power-sharing government, including the current government, formed in connection with the April 23, 2014, agreement between the Palestinian Liberation Organization (PLO) and Hamas to be a &quot;Hamas-controlled Palestinian Authority (PA)&quot; and thus subject to specified restrictions under the Foreign Assistance Act of 1961. States that until the Secretary of State certifies to Congress that the United Nations Human Rights Council (UNHRC)'s agenda does not include a permanent item related to Israel or the Palestinian territories: (1) the U.S. contribution to the regular budget of the United Nations (U.N.) shall be reduced by a specified amount, (2) the Secretary shall not make a voluntary contribution to UNHRC, and (3) the United States shall not run for an UNHRC seat. Amends the Foreign Assistance Act of 1961 to prohibit U.S. contributions to the United Nations Relief and Works Agency for Palestine Refugees in the Near East (UNRWA) for programs in the West Bank and Gaza until the Secretary certifies to Congress that: no official, employee, consultant, or affiliate of UNRWA is a member of Hamas or any U.S.-designated terrorist group, or has propagated or incited anti-Israel or anti-Semitic rhetoric; no UNRWA facility or resource is being used by Hamas or an affiliated group for any purpose; UNRWA is subject to audits by an internationally recognized third party auditing firm and has implemented an oversight system to prevent the use of UNRWA resources by Hamas or any U.S.-designated terrorist group; and no recipient of UNRWA funds or loans is a member of Hamas or any U.S.-designated terrorist group. Authorizes the equivalent amount of all U.S. contributions withheld from the PA, UNHRC, and UNRWA under this Act to be provided to Israel for Iron Dome and other missile defense systems and for underground warfare training and technology.","[{'label': 'specifically,', 'score': 0.36709433794021606}, {'label': 'further,', 'score': 0.18376673758029938}, {'label': 'specifically,', 'score': 0.23012639582157135}, {'label': 'NAN', 'score': 'NAN'}, {'label': 'further,', 'score': 0.265245258808136}]"
"Stop Abuse, Violence, and Exploitation of Elders Act of 2012 or the SAVE Elders Act of 2012 - Amends the Victims of Crime Act of 1984 to designate specified funds from the Crime Victims Fund for grants for compensation and assistance to victims of elder abuse.Defines ""elder abuse"" under that Act: (1) to mean the abuse, exploitation, or neglect of an individual who is age 65 or older and lawfully present in the United States; and (2) with respect to a state that receives a grant, to include any other conduct that is defined as such under the laws of the state.Requires the Director of the Office of Victims of Crime to use such funds to make grants to states to support: (1) eligible crime victim assistance programs that provide assistance to victims of elder abuse; and (2) programs that improve the investigation, handling, and prosecution of cases of elder abuse.Apportions specified percentages of grant amounts among the states, the District of Columbia, Puerto Rico, Guam, the U.S. Virgin Islands, American Samoa, and the Northern Mariana Islands and requires the amounts remaining after such apportionment to be distributed among the states based on: (1) the population of individuals age 65 or older in a state relative to the population of such individuals in all states, (2) the population of individuals age 65 or older in a state in relation to the population of the state, and (3) the overall rate of crime in a state.","[{'label': 'additionally', 'score': 0.14706389605998993}, {'label': 'further,', 'score': 0.2867465913295746}, {'label': 'specifically,', 'score': 0.6478039026260376}, {'label': 'NAN', 'score': 'NAN'}]"
"Catalyst to Better Diabetes Care Act of 2007 - Requires the Secretary of Health and Human Services (the Secretary) to: (1) review uptake and utilization of the Medicare diabetes screening benefit; (2) establish an outreach program to identify existing efforts to increase awareness of the diabetes screening benefit among Medicare beneficiaries and providers; and (3) maximize economies of scale, cost-effectiveness, and resource allocation in increasing utilization of the diabetes screening benefit.Requires the Secretary of Commerce to establish an advisory group to examine and recommend best practices of chronic illness employee wellness incentivization and disease management programs.Directs the Secretary to prepare, biennially, a diabetes report card for the nation and for each state.Requires the Secretary, acting through the Director of the Centers for Disease Control and Prevention (CDC), to: (1) promote the education and training of physicians on how to properly complete birth and death certificates and the importance of such data; (2) encourage state adoption of the latest standard revisions of birth and death certificates; and (3) work with states to reengineer their vital statistics systems to provide cost-effective, timely, and vital systems data. Allows the Secretary to promote the addition to death certificates of language to improve the collection of diabetes mortality data.Requires the Secretary to conduct a study of the impact of diabetes on the practice of medicine in the United Sates and the level of diabetes medical education that should be required prior to licensure, board certification, and board recertification.","[{'label': 'specifically,', 'score': 0.5930864214897156}, {'label': 'specifically,', 'score': 0.3333728015422821}, {'label': 'thereafter,', 'score': 0.1047697588801384}, {'label': 'specifically,', 'score': 0.6280608177185059}, {'label': 'third,', 'score': 0.17566172778606415}, {'label': 'specifically,', 'score': 0.26609063148498535}]"
"Serving America's Veterans Effectively Act of 2014 or the SAVE Act of 2014 - Directs the Secretary of Health and Human Services (HHS) to: require the inclusion of a patient's status as a veteran in the patient information that the Secretary requires for meaningful use of electronic health records under the Medicare and Medicaid programs, include an inquiry into whether a patient is a veteran and any relevant circumstances relating to a veteran's service in the Armed Forces as part of the initial preventive examination of Medicare beneficiaries, and take such additional actions as may be appropriate to promote awareness among nongovernmental physicians of the special circumstances and health care needs of veterans. Authorizes the Secretary to make grants to organizations to educate health care providers on appropriate health care for veterans.","[{'label': 'NAN', 'score': 'NAN'}, {'label': 'additionally', 'score': 0.1981489062309265}]"
"Illinois and Michigan Canal National Heritage Corridor Act Amendments of 2005 - Amends the Illinois and Michigan Canal National Heritage Corridor Act of 1984 to designate, upon the termination of the Illinois and Michigan Canal National Heritage Corridor Commission, the Canal Corridor Association to be the management entity for the Illinois and Michigan Canal National Heritage Corridor.Requires the Association to develop and submit a proposed management plan for the Corridor to the Secretary of the Interior for approval.Authorizes the Secretary to provide technical and financial assistance to the Association for the development and implementation of the management plan.","[{'label': 'additionally', 'score': 0.25380128622055054}, {'label': 'additionally', 'score': 0.22902938723564148}, {'label': 'further,', 'score': 0.1958208680152893}]"
