summary_clean,summary_tag
"Fair Telephone Billing Act of 2012 - Amends the Communications Act of 1934 to prohibit local exchange carriers or providers of interconnected VoIP (Voice over Internet Protocol) service from placing a third-party charge that is not directly related to the provision of telephone services on the bill of a customer, unless the third-party charge is: (1) from a certified third-party vendor, (2) for a product or service that the carrier or provider markets or sells jointly with its own service, and (3) consented to and believed to be requested by the customer.Defines a ""third-party charge"" as a charge for a product or service not provided by a local exchange carrier or a provider of interconnected VoIP service that is included on a bill for the services the local exchange carrier or provider of interconnected VoIP service offers to its customers.Subjects violators to civil forfeiture and specified penalties.Directs the Federal Communications Commission (FCC) to promulgate rules to: (1) ensure that a provider of wireless services gives each customer the means to avoid receiving third-party charges on the wireless customer's wireless bill and discloses such an option clearly and conspicuously, (2) establish procedures for such a provider to ensure that third-party charges have been authorized by the wireless customer; and (3) enable a wireless customer to seek and receive reimbursement from the provider for any unauthorized third-party charges.","[{'label': 'NAN', 'score': 'NAN'}, {'label': 'specifically,', 'score': 0.1529688686132431}, {'label': 'generally,', 'score': 0.1346748173236847}, {'label': 'NAN', 'score': 'NAN'}]"
". Women's Procurement Program Equalization Act of 2013 - Amends the Small Business Act with respect to the procurement program for women-owned small businesses (providing a federal procurement contracting preference to such businesses) to condition a government contracting officer's authority to restrict competition for any such federal contract upon the Administrator of the Small Business Administration (SBA) certifying each of the businesses as a small business concern owned and controlled by women. (Currently, the small business concerns themselves certify to the contracting officer that they are such a business according to SBA standards.) Allows a contracting officer to award a sole source contract to any economically disadvantaged women-owned small business if: (1) the small business is determined to be responsible and the contracting officer does not expect two or more of such businesses to submit offers; (2) the anticipated contract price will not exceed $6.5 million in the case of a manufacturing contract, or $4 million in the case of all other contracts; and (3) the contract can be made at a fair and reasonable price. Provides identical contracting authority for women-owned small businesses in substantially underrepresented industries. Expands the reporting requirements with respect to small business procurement contracts to require federal agencies to submit annual reports to the Administrator regarding such sole source contracts as well as the industries within which various contracts were awarded.","[{'label': 'arguably,', 'score': 0.06450679898262024}, {'label': 'specifically,', 'score': 0.4342348873615265}, {'label': 'further,', 'score': 0.1125284880399704}, {'label': 'specifically,', 'score': 0.4689979553222656}, {'label': 'specifically,', 'score': 0.32980915904045105}, {'label': 'specifically,', 'score': 0.6532237529754639}]"
"Digital Consumer Right to Know Act - Directs the Federal Trade Commission (FTC) to issue rules to implement requirements that a producer or distributor of copyrighted digital content disclose the nature of restrictions that limit the practical ability of the content purchaser to play, copy, transmit, or transfer such content on, to, or between devices commonly used with respect to that type of content. Requires such disclosure in the case of limitations on: (1) the recording for later viewing or listening of certain audio or video programming; (2) the reasonable and noncommercial use of legally acquired audio or video content; (3) making backup copies of legally acquired content subject to accidental damage, erasure, or destruction; (4) using limited excerpts of legally acquired content; and (5) engaging in the secondhand transfer or sale of legally acquired content. Provides disclosure exceptions. Requires the FTC to annually review the effectiveness of such rules.Expresses the sense of Congress that: (1) competition among distribution outlets and methods generally benefits consumers; and (2) copyright holders selling digital content in electronic form for distribution over the Internet should offer to license such content to multiple unaffiliated distributors.","[{'label': 'specifically,', 'score': 0.7269106507301331}, {'label': '[no-conn]', 'score': 0.2873554527759552}, {'label': '[no-conn]', 'score': 0.11147493124008179}, {'label': 'further,', 'score': 0.22703561186790466}, {'label': 'accordingly', 'score': 0.2341243028640747}]"
"Fort Peck Reservation Rural Water System Act of 1997 - Directs the Secretary of the Interior to plan, design, construct (including replacement of structures and equipment), operate, maintain, and replace the Fort Peck Reservation Rural Water System (Water System). Directs the Secretary to enter into a cooperative agreement with the Fort Peck Tribal Executive Board regarding the Water System. Provides that title to the Water System be held in trust by the United States for the Fort Peck Tribes and not be transferred unless a transfer is authorized by an Act of Congress enacted after the enactment of this Act. Limits the availability of construction funds for the construction of the Water System until certain requirements are met. Directs the Water System to use power from the Pick-Sloan Missouri Basin Program for operation. Considers use of the power to be a project use pumping requirement of Pick-Sloan. Directs the Secretary to enter into a cooperative agreement with appropriate non-Federal entities to provide Federal funds for the planning, design, and construction of the Roosevelt, Sheridan, Daniels, and Valley Counties Water System (Counties System), Montana, outside the Fort Peck Indian Reservation. Limits the Federal share to 75 percent. Requires cooperative agreement concurrence by the Water System Board. Authorizes the Secretary to: (1) interconnect the Counties System with the Water System; and (2) provide for the delivery of water to the Counties System, without charge, from the Missouri River through the Water System. Prohibits Federal funds from being used for operation and maintenance expenses associated with water deliveries to the Counties System. Authorizes appropriations.","[{'label': '[no-conn]', 'score': 0.6468760967254639}, {'label': 'specifically,', 'score': 0.16192840039730072}, {'label': 'further,', 'score': 0.1992080956697464}, {'label': '[no-conn]', 'score': 0.4818519055843353}, {'label': '[no-conn]', 'score': 0.16594748198986053}, {'label': 'additionally', 'score': 0.07418978214263916}, {'label': 'specifically,', 'score': 0.2382391393184662}, {'label': 'nationally,', 'score': 0.06130592152476311}, {'label': '[no-conn]', 'score': 0.42713406682014465}, {'label': 'further,', 'score': 0.159762442111969}, {'label': 'specifically,', 'score': 0.1921754628419876}, {'label': '[no-conn]', 'score': 0.08570857346057892}]"
American Burying Beetle Relief Act of 2014 - Removes the United States Fish and Wildlife Service's listing of the American burying beetle as an endangered species under the Endangered Species Act. Prohibits the beetle from being listed as a threatened or endangered species.,"[{'label': 'additionally', 'score': 0.26195186376571655}, {'label': '[no-conn]', 'score': 0.23873047530651093}]"
"Net Price Calculator Improvement Act - Amends the Higher Education Act of 1965 to establish the minimum requirements for the net price calculator that each institution of higher education (IHE) receiving federal funds under title IV (Student Assistance) of the Act must include on its website. (An IHE's ""net price"" is the average yearly price actually charged to first-time, full-time undergraduate students receiving student aid at the school after deducting such aid.) Requires the link for the calculator to be clearly labeled and conspicuously posted on an IHE's website. Requires each calculator's results page to include: the individual net price of attending the IHE (the individual net price is calculated like the net price but takes into account the cost of attendance for, and aid available to, the individual student to the extent practicable); the cost of attending the IHE; the estimated total need- and merit-based grant aid from federal, state, and institutional sources that may be available to the individual student; the percentage of such students enrolled at the school who receive any of that grant aid; and a notice that an estimate of an individual's net price is non-binding and subject to change. Requires calculators that estimate a user's eligibility for veterans' education benefits or educational benefits for active duty service members to clearly distinguish those benefits from other grant-aid. Requires calculators that do not make such estimates to provide users with notice of, and a link to information concerning, those benefits. Directs IHEs to populate their calculators with data from not earlier than two academic years prior to the most recent academic year. Requires the calculators to: (1) clearly indicate which questions need to be completed for a net price estimate, (2) clearly mark requests for contact information as optional, (3) prohibit personally identifiable information from being sold or made available to third parties, and (4) clearly state that any information a user provides is confidential and that the calculator does not store responses or require personal identifying information. Authorizes the Secretary of Education to develop a universal net price calculator that enables users to answer one set of questions and receive net prices for any IHE that is required to have a net price calculator.","[{'label': 'additionally', 'score': 0.2932398021221161}, {'label': 'by_contrast,', 'score': 0.1445634514093399}, {'label': 'additionally', 'score': 0.3011120557785034}, {'label': 'NAN', 'score': 'NAN'}, {'label': 'additionally', 'score': 0.24015699326992035}, {'label': 'additionally', 'score': 0.15553171932697296}, {'label': 'specifically,', 'score': 0.12725763022899628}, {'label': 'additionally', 'score': 0.38626015186309814}, {'label': 'specifically,', 'score': 0.2087821066379547}]"
Sets forth the tax and estate tax treatment of designated beneficiaries and contributors.,"[{'label': 'specifically,', 'score': 0.22802120447158813}]"
"Amends federal monetary law relating to reduction of a tax refund by the amount of a tax debt to establish a pilot program during 2009 and 2010 for the collection of past-due legally enforceable local government tax obligations.Instructs the Secretary of the Treasury, upon receiving notice from any eligible state on behalf of a local government that a named person owes such local government a past-due, legally enforceable tax obligation, to: (1) reduce the federal tax refunds payable to such person by the amount of such debt; (2) pay the amount of such reduction to the state for payment to the affected local government; (3) notify the state of the person's name, taxpayer identification number, address, and the amount collected; and (4) notify the person due the refund that it has been reduced by an amount necessary to satisfy a past-due, legally enforceable tax obligation.Requires the Secretary to select between three and five states to participate in the pilot program, including from among: (1) Illinois; (2) Iowa; (3) Louisiana; (4) New York; (5) Ohio; and (6) Virginia.Amends the Internal Revenue Code to permit disclosure of taxpayer information to agencies of states requesting refund offsets for tax debts owed to local governments.","[{'label': 'specifically,', 'score': 0.17623305320739746}, {'label': 'NAN', 'score': 'NAN'}, {'label': 'specifically,', 'score': 0.3047674298286438}, {'label': 'specifically,', 'score': 0.22202149033546448}]"
"401Kids Family Savings Act of 2013 - Amends the Internal Revenue Code to: (1) rename Coverdell education savings accounts as 401Kids savings accounts, (2) allow the use of such accounts to pay the acquisition costs of a first-time homebuyer, and (3) allow tax-free rollovers of amounts in a 401Kids savings account to a Roth individual retirement account (Roth IRA). ","[{'label': 'specifically,', 'score': 0.27068713307380676}]"
"Directs the Secretary of Defense to list, and publish in the Federal Register, persons who are Communist Chinese military companies operating directly or indirectly in the United States or any of its territories and possessions. Authorizes the President to exercise authorities under the International Emergency Economic Powers Act (except those relating to importation) to regulate, prohibit, or penalize certain transactions involving foreign currency, transfers of credit, or property with respect to any activities of such companies in the United States.","[{'label': 'further,', 'score': 0.16889826953411102}, {'label': 'specifically,', 'score': 0.4499323070049286}]"
"Firearms Corrections and Improvements Act - Amends firearms provisions of the federal criminal code to: (1) lift restrictions on the possession, transfer, and importation of machineguns, and certain other shotguns and rifles, for contractors providing national security services for the United States and training related to such services, and for manufacturers for testing, research, design, or development purposes; (2) prohibit the Attorney General from charging any tax or fee for any background check by the national instant criminal background check system; (3) permit juveniles to possess and use a handgun or ammunition for certain activities without written parental consent if the parent is present when the juvenile is using the handgun; (4) eliminate certain reporting requirements for multiple handgun sales (more than one sale within five days) by dealers to state police and law enforcement agencies; (5) prohibit the Attorney General from electronically retrieving records of gun dealers who have gone out of business by name or any personal identification code; (6) limit disclosure of trace records; and (7) allow importation of barrels, frames, and receivers for firearms other than handguns for repair or replacement purposes.","[{'label': 'NAN', 'score': 'NAN'}]"
"New Automobile Add-On Disclosure and Consumer Protection Act - Requires each dealer to disclose to each consumer that purchases a new automobile: (1) a dealer add-on invoice; and (2) a dealer add-on warranty statement.Specifies the timing of such disclosures.States that dealer violation of this Act results in liability to the United States for a civil penalty of not more than $10,000 or the total cost of the new automobile involved (including add-ons, taxes, and any other fees charged to the customer by the dealer), whichever is greater.Permits a private right of action by a consumer aggrieved by a violation of this Act.","[{'label': 'specifically,', 'score': 0.6370058059692383}, {'label': 'further,', 'score': 0.11563743650913239}, {'label': 'or,', 'score': 0.1649377942085266}, {'label': 'accordingly', 'score': 0.21909551322460175}]"
"Small Business Tax Fairness and Simplification Act of 2007 - Amends the Internal Revenue Code to: (1) allow self-employed individuals to participate in cafeteria pension plans; (2) allow long-term care insurance under cafeteria plans and flexible spending arrangements; (3) allow accelerated amortization of certain intangible assets (e.g., good will) acquired from a small business; (4) increase the tax exclusion of gain from the sale of certain small business stock; (5) provide a $2,500 standard tax deduction for home business expenses; (6) permit certain small businesses to elect a taxable year ending in a month from April to November; (7) increase the allowable number of S corporation shareholders; and (8) exempt certain small businesses from withholding of tax requirements for payments made by government entities.","[{'label': 'NAN', 'score': 'NAN'}]"
"Close the Revolving Door Act of 2014 - Amends the federal criminal code to impose a lifetime ban on any former Senator, Member of the House of Representatives, or elected officer of the Senate or House of Representatives lobbying any current Member, officer, or employee of Congress or any employee of any other legislative office (currently, the ban is for two years after a Senator leaves office and one year after a Member of the House of Representatives leaves office). Extends such ban from one to six years for officers and employees of the Senate, personal staff of Members, committee staff, leadership staff, and other legislative offices. Prohibits for a six-year period the hiring of a registered lobbyist or agent of a foreign principal by a Member of Congress or a congressional committee with whom the lobbyist or agent has had a substantial lobbying contact. Amends the Lobbying Disclosure Act of 1995 to: (1) direct the Secretary of the Senate and the Clerk of the House of Representatives to maintain a joint lobbyist disclosure Internet database for information required to be publicly disclosed by such Act, (2) require a substantial lobbying entity to file with Congress a list of any employees who provide paid consulting services and who are former Members of Congress or highly-paid congressional staffers, and (3) increase the civil penalty for violations of the disclosure or reporting provisions of such Act. ","[{'label': 'specifically,', 'score': 0.1798229068517685}, {'label': 'additionally', 'score': 0.21433977782726288}, {'label': 'specifically,', 'score': 0.27427464723587036}, {'label': 'NAN', 'score': 'NAN'}]"
"Tracing and Recalling Agricultural Contamination Everywhere Act of 2007 or TRACE Act of 2007- Amends the Federal Meat Inspection Act to direct the Secretary of Agriculture to establish a traceability system for all stages of manufacturing, processing, packaging, and distribution of food.States that cattle, sheep, swine, goats, horses, mules and other equines, and poultry presented for slaughter for human consumption, and the carcasses or parts of carcasses and the meat and food products of those animals, shipped in interstate commerce shall be identified in a manner that enables the Secretary to trace: (1) each animal to any location at which the animal was held at any time before slaughter; and (2) each carcass or part of a carcass and food product forward from slaughter through processing and distribution to the ultimate consumer.Directs the Secretary to establish a traceability system for all stages of production, processing, and distribution of meat and meat food products produced through the slaughter of such animals.Authorizes the Secretary to: (1) prohibit or restrict entry to a slaughtering establishment of an animal not so identified; and (2) require a person or entity to maintain records.Amends the Poultry Products Inspection Act and the Egg Products Inspection Act to establish similar provisions for poultry and poultry products and for eggs and egg products.","[{'label': 'specifically,', 'score': 0.42456862330436707}, {'label': 'NAN', 'score': 'NAN'}, {'label': 'further,', 'score': 0.21539674699306488}, {'label': '[no-conn]', 'score': 0.36780792474746704}, {'label': 'specifically,', 'score': 0.5164453387260437}]"
"Federal Workforce Reduction and Realignment Commission Act - Establishes an independent Federal Workforce Reduction and Realignment Commission to develop and submit to the President and the Congress recommendations for reducing the number of Federal employees nationwide in non-defense-related agencies by 250,000.","[{'label': 'specifically,', 'score': 0.2521529793739319}]"
"Medicaid Expansion Incentive Act of 2017 This bill amends title XIX (Medicaid) of the Social Security Act to provide additional federal Medicaid funding to states&nbsp;participating in&nbsp;Medicaid expansion under the Patient Protection and Affordable Care Act. The amount of additional funding shall be&nbsp;based upon the net reduction in federal funding&nbsp;for nonparticipating states. The Centers for Medicare &amp; Medicaid Services must publish annually,&nbsp;with respect to&nbsp;each nonparticipating state: (1) the amount of federal funding forgone by the state as a result of its nonparticipation, and (2) the number of individuals who would have gained coverage had the state participated.","[{'label': 'specifically,', 'score': 0.24734526872634888}, {'label': 'further,', 'score': 0.10638080537319183}, {'label': 'specifically,', 'score': 0.5789342522621155}]"
"Children's Act for Responsible Employment of 2005 - CARE Act of 2005 - Amends the Fair Labor Standards Act of 1938 (FLSA) to repeal certain exemptions from child labor prohibitions for agricultural employment. Allows an exemption only if: (1) the agricultural employment of an individual under 16 occurs outside of school hours; and (2) such individual is employed by a parent or a person standing in place of a parent on a farm owned or operated by such parent or person. Raises from 16 to 18 years old the minimum age for engaging in hazardous agricultural employment. Eliminates a waiver for hand-harvesting of certain crops.Increases civil and criminal penalties for child labor violations.Directs the Secretary of Labor to analyze data and report to Congress on work-related injuries to children and related matters. Requires employers to report on work-related serious injuries and illnesses, and deaths, of agricultural employees under 18 years of age.Directs the Secretary to: (1) employ at least 100 additional inspectors within the Wage and Hour Division of the Department of Labor to enforce child labor laws; and (2) provide for a ten percent increase in the budget for the Employment Standards Division within the office of the Solicitor of Labor to increase prosecution of violations of such laws. Incorporates into FLSA child labor requirements certain federal standards for protecting workers exposed to pesticides. Reconciles civil penalties for violations of such standards affecting child workers imposed by the Secretary under FLSA and by the Administrator of the Environmental Protection Agency under the Federal Insecticide, Fungicide, and Rodenticide Act.Amends the Workforce Investment Act of 1998 to direct the Secretary to make competitive grants for specified types of programs for migrant and seasonal farmworker youth dropout prevention.","[{'label': 'specifically,', 'score': 0.5355936288833618}, {'label': '[no-conn]', 'score': 0.20080359280109406}, {'label': 'nationally,', 'score': 0.35079270601272583}, {'label': 'additionally', 'score': 0.39144739508628845}, {'label': 'additionally', 'score': 0.42677628993988037}, {'label': 'specifically,', 'score': 0.21347323060035706}, {'label': 'additionally', 'score': 0.29305562376976013}, {'label': 'further,', 'score': 0.32711341977119446}, {'label': 'separately,', 'score': 0.18835735321044922}, {'label': 'specifically,', 'score': 0.20388829708099365}, {'label': 'specifically,', 'score': 0.5849199891090393}]"
"Energy Consumers Relief Act of 2013 - Requires the Administrator of the Environmental Protection Agency (EPA), before promulgating a final rule that regulates any aspect of the production, supply, distribution, or use of energy (or that provides for such regulation by state or local governments) and that is estimated by the Administrator or the Director of the Office of Management and Budget (OMB) to impose aggregate costs of more than $1 billion, to submit a report that contains: (1) an estimate of the total costs and benefits of the rule, (2) an estimate of the increases in energy prices that may result from implementation or enforcement of the rule, and (3) a detailed description of the employment effects that may result from implementation or enforcement of the rule. Requires the Secretary of Energy (DOE): (1) to prepare an independent analysis to determine whether such rule will cause any increase in energy prices for consumers, any impact on fuel diversity of the nation's electricity generation portfolio or on electric reliability, or any adverse effect on energy supply, distribution, or use; and (2) upon making such a determination, to determine whether the rule will cause significant adverse effects to the economy and publish such determination in the Federal Register. Prohibits the Administrator from promulgating any such final rule if the Secretary determines that such rule will cause significant adverse effects to the economy. Prohibits the Administrator from using the social cost of carbon in any cost-benefit analysis relating to an energy-related rule estimated to cost more than $1 billion unless and until a federal law is enacted authorizing such use. ","[{'label': 'NAN', 'score': 'NAN'}, {'label': 'NAN', 'score': 'NAN'}, {'label': 'further,', 'score': 0.4294091761112213}, {'label': 'further,', 'score': 0.22564148902893066}]"
