summary_clean,summary_tag
"Open Fuel Act of 2015 This bill requires each fleet of a manufacturer of passenger automobiles (including light-duty motor vehicles) to comprise at least: 30% qualified vehicles in model year 2018, and 50% qualified vehicles in model year 2019 and each subsequent year. A &quot;qualified vehicle&quot; is: a vehicle that operates on natural gas, hydrogen, or biodiesel; a flexible fuel vehicle capable of operating on gasoline, E85, and M85; a plug-in electric drive vehicle; or a vehicle propelled solely by fuel cell or by something other than an internal combustion engine. The bill authorizes a manufacturer to request an exemption from such requirement from the Department of Transportation.","[{'label': 'thereafter,', 'score': 0.4624269902706146}, {'label': 'optionally,', 'score': 0.19773752987384796}, {'label': 'significantly,', 'score': 0.12139208614826202}]"
"Gallatin Land Consolidation Act of 1998 - Authorizes a land exchange (for inclusion in the Gallatin National Forest) between the Secretaries of Agriculture and the Interior and the Big Sky Lumber Company (BSL). Provides that if BSL offers fee title to specified land that is acceptable to the United States, the Secretary of: (1) Agriculture shall accept a warranty deed to the land, convey to BSL (subject to specified limitations) fee title to up to 25,000 acres of National Forest System land, grant to BSL timber harvest rights to up to 50 million board feet of timber, and (subject to availability of funds) purchase land belonging to BSL in the Taylor Fork area at a purchase price of up to $6.5 million; and (2) the Interior shall convey fee title to approximately 1,860 acres of Bureau of Land Management land. Requires that the property and other assets exchanged by BSL and the United States be approximately equal in value, as determined by the Secretary of Agriculture. Directs the Secretary of Agriculture to prepare, grant to BSL, and administer specified timber harvest rights over a period of five consecutive years. Specifies that timber harvest volume shall constitute the timber sale program for the Gallatin National Forest for that five-year period. Directs such Secretary, if exceptional circumstances prevent the Secretary from conveying such rights, to replace the value of the diminished harvest rights by substituting equivalent timber harvest rights volume from the same market area, conveying national forest lands containing merchantable timber with such Forest, or making a payment from funds from the Land and Water Conservation Fund. Sets forth provisions regarding: (1) procedures applicable to all national forest timber harvest rights identified for exchange; (2) the exchange agreement; (3) rights-of-way; (4) quality of title; and (5) timing of implementation of the exchange agreement.","[{'label': 'specifically,', 'score': 0.5397854447364807}, {'label': 'NAN', 'score': 'NAN'}, {'label': 'further,', 'score': 0.2794688045978546}, {'label': 'thereafter,', 'score': 0.5106574296951294}, {'label': 'thereafter,', 'score': 0.7170680165290833}, {'label': 'further,', 'score': 0.14407230913639069}, {'label': 'specifically,', 'score': 0.6137754917144775}]"
"Requires the International Trade Commission to notify the Secretary immediately whenever it begins an investigation into whether an agricultural commodity is being imported into the United States in such increased quantities as to be a substantial cause or threat of serious injury to a domestic industry producing an agricultural commodity like or directly competitive with the imported agricultural commodity. Requires the Secretary, upon such notification, to study and report to the President and the public on: (1) the number of agricultural commodity producers who have been or are likely to be certified as eligible for trade adjustment assistance; and (2) the extent to which the adjustment of such producers to the import competition may be facilitated through the use of existing programs.Directs the Secretary to provide agricultural commodity producers with information about trade adjustment assistance petition and application procedures, benefit allowances, training, and other employment services.Sets forth certain eligibility requirements for the payment of trade adjustment assistance to adversely affected agricultural commodity producers. Limits to $10,000 the maximum annual amount of cash benefits a producer may receive.Provides for the repayment and recovery of overpayments of trade adjustment assistance made to such producers due to fraud. Sets forth penalties.Authorizes appropriations.","[{'label': 'further,', 'score': 0.3960619270801544}, {'label': 'specifically,', 'score': 0.24156226217746735}, {'label': 'additionally', 'score': 0.3258627951145172}, {'label': 'specifically,', 'score': 0.49826523661613464}, {'label': 'generally,', 'score': 0.2878953218460083}, {'label': 'specifically,', 'score': 0.19095417857170105}, {'label': 'generally,', 'score': 0.11080803722143173}, {'label': '[no-conn]', 'score': 0.08570857346057892}]"
"Establishes the World War I Centennial Commission to: (1) plan, develop, and execute programs, projects, and activities to commemorate the centennial of World War I; (2) encourage private organizations and state and local governments to organize and participate in such activities; (3) facilitate and coordinate such activities throughout the United States; and (4) serve as a clearinghouse for the collection and dissemination of information about centennial events and plans; and (5) develop commemoration recommendations for Congress and the President.","[{'label': 'NAN', 'score': 'NAN'}]"
"National Marine Sanctuaries Renewal Act of 1996 - Amends the National Marine Sanctuaries Act to authorize the Secretary of Commerce to: (1) create, or participate in the creation of, nonprofit organizations to solicit donations to carry out the Act; and (2) recruit, train, and accept volunteer services and provide for incidental expenses such as transportation, uniforms, lodging, and subsistence of the volunteers. Authorizes appropriations to carry out the Marine Protection, Research, and Sanctuaries Act of 1972. Modifies national marine sanctuary advisory committee procedural requirements. Authorizes: (1) the development, marketing, and sale of symbols, including a symbol for the national marine sanctuary program (NMSP); (2) the designation of persons as official sponsors of the NMSP or individual sanctuaries; (3) the creation, marketing, and sale of products to promote the NMSP; (4) establishment of a revolving fund containing sponsor payments and product sale proceeds; (5) the use of in-kind sponsor proceeds; and (6) the expenditure of fund amounts, without appropriation, to designate and manage sanctuaries.","[{'label': 'specifically,', 'score': 0.5389324426651001}, {'label': 'specifically,', 'score': 0.23370309174060822}, {'label': 'additionally', 'score': 0.16301977634429932}, {'label': 'NAN', 'score': 'NAN'}]"
"Fair Employment Opportunity Act of 2011 - Declares it an unlawful practice for certain employers with at least 15 employees for each working day in each of at least 20 calendar weeks in the current or preceding calendar year to: (1) refuse to consider or offer employment to an individual based on present or past unemployment regardless of the length of time such individual was unemployed; (2) publish an advertisement or announcement for any job with provisions indicating that such an unemployed status disqualifies an individual and that an employer will not consider an applicant based on such status; and (3) direct or request that an employment agency account for such status when screening or referring applicants.Prohibits an employment agency (including agents and persons maintaining a website publishing job advertisements or announcements), based on such an individual's status as unemployed, from: (1) refusing to consider or refer an individual for employment; (2) limiting, segregating, or classifying individuals in any manner limiting access to job information; or (3) publishing an advertisement or announcement for any job vacancy that includes provisions indicating that such an individual is disqualified and that an employer will not consider such individuals.Allows consideration of an individual's status as unemployed where an individual's employment in a similar or related job for a period of time reasonably proximate to the hiring of such individual is a bona fide occupational qualification reasonably necessary to successful performance of the job being filled.Authorizes, subject to termination upon the filing of certain complaints by the Secretary of Labor, one or more persons for and in behalf of the affected individual, or the affected individual and other individuals similarly situated, to bring actions in federal or state court for specified actual damages and equitable relief including employment and compensatory and punitive damages.Directs the Secretary to: (1) receive, investigate, and attempt to resolve complaints according to specified provisions of the Fair Labor Standards Act of 1938; and (2) pay directly to each affected individual applicable sums recovered in any civil actions brought by the Secretary under this Act.Sets forth a two-year statute of limitations period (three years for willful violations) for specified civil actions under this Act, subject to tolling when the Secretary is considering certain complaints.","[{'label': 'NAN', 'score': 'NAN'}, {'label': 'NAN', 'score': 'NAN'}, {'label': 'further,', 'score': 0.16737841069698334}, {'label': 'additionally', 'score': 0.1928008794784546}, {'label': 'further,', 'score': 0.13483357429504395}, {'label': 'thereafter,', 'score': 0.3754429519176483}]"
"American Veterans Disabled for Life Commemorative Coin Act - Directs the Secretary of the Treasury to mint and issue $1 silver coins in commemoration of disabled American veterans and emblematic of the design selected by the Disabled Veterans' LIFE Memorial Foundation for the American Veterans Disabled for Life Memorial.Expresses the sense of Congress that, to the greatest extent possible, the coins should be struck at the U.S. Mint at West Point, New York. Limits the period for coin issuance to calendar year 2010.Imposes a $10 surcharge per coin, to be distributed to the Disabled Veterans' LIFE Memorial Foundation for the purpose of establishing an endowment to support the construction of American Veterans' Disabled for Life Memorial in Washington, D.C.","[{'label': '[no-conn]', 'score': 0.5065541863441467}, {'label': 'accordingly', 'score': 0.6662125587463379}, {'label': 'additionally', 'score': 0.40107262134552}]"
"Independent Ethics Commission Act of 2007 - Establishes within the House of Representatives an Independent Ethics Commission composed only of former federal judges.Prescribes procedures for: (1) initiation of investigations, upon the filing of a complaint or upon the Commission's own initiative; and (2) for consequent actions.","[{'label': 'specifically,', 'score': 0.17241817712783813}, {'label': '[no-conn]', 'score': 0.38458117842674255}]"
"Rural Safety and Law Enforcement Improvement Act- Amends the Omnibus Crime Control and Safe Streets Act of 1968 to: (1) authorize the Attorney General to make grants to rural local and tribal governments for the retention for one additional year of police officers funded through the cops on the beat (or COPS) program; (2) authorize the use of COPS grants on a matching funds basis to assist the police departments of such units in improving police communications, and in developing and improving access to crime-solving technologies; and (3) hire personnel and purchase equipment for rural areas to assist in the enforcement and prosecution of methamphetamine offenses and the environmental cleanup of methamphetamine-affected areas.Directs the Office of Justice Programs of the Department of Justice to make grants to such units to establish or improve 911 service in those communities.Amends the Public Health Service Act to require the Secretary of Health and Human Services, acting through the Director of the Center for Substance Abuse Treatment, to make grants to establish in rural areas substance abuse (particularly methamphetamine) prevention and treatment pilot programs and methamphetamine prevention education programs.Directs the Attorney General to provide for the cleanup of methamphetamine laboratories and related hazardous waste, and for the improvement of contract-related response time for cleanup of methamphetamine laboratories and related hazardous waste by providing additional contract personnel, equipment, and facilities, in rural areas.Establishes a Rural Policing Institute as part of the Small Town and Rural Training Program..","[{'label': 'NAN', 'score': 'NAN'}, {'label': 'specifically,', 'score': 0.19608788192272186}, {'label': 'specifically,', 'score': 0.5865542888641357}, {'label': 'specifically,', 'score': 0.628780722618103}, {'label': '[no-conn]', 'score': 0.4277650713920593}]"
"Debt Reduction Priority Act - Amends the Emergency Economic Stabilization Act of 2008 (EESA) to require the Secretary of the Treasury to deposit in the Public Debt Reduction Payment Account (established by this Act) amounts received for repayment of financial assistance or payment of interest on the receipt of such assistance by an entity under the Troubled Asset Relief Program (TARP) or any program enacted by the Secretary under the authorities granted under such Act, including the Capital Purchase Program.Requires the Secretary to use amounts in the Account to pay at maturity, or to redeem or buy before maturity, any obligation of the government held by the public and included in the public debt.Reduces the public debt limit by the aggregate of amounts deposited into the Account. Excludes receipts and disbursements of the Account from consideration as new budget authority, outlays, receipts, or deficit or surplus for purposes of the President's budget, the congressional budget, or the Balanced Budget and Emergency Deficit Control Act of 1985. Requires outlays and receipts of the Account to be excluded from any official statement of budget surplus or deficit totals issued by the Office of Management and Budget (OMB), the Congressional Budget Office (CBO), or any other federal agency or instrumentality.","[{'label': 'NAN', 'score': 'NAN'}, {'label': 'further,', 'score': 0.2496887445449829}, {'label': 'accordingly', 'score': 0.16385939717292786}, {'label': '[no-conn]', 'score': 0.27301225066185}, {'label': '[no-conn]', 'score': 0.315698504447937}]"
"Authorizes the Secretary of the Interior to accept title to any additional number of acres of real property located within the boundaries of the original 1857 reservation of the Confederated Tribes of the Grand Ronde Community of Oregon (comprised of land within the political boundaries of Polk and Yamhill Counties, Oregon), if such real property is conveyed or otherwise transferred to the United States by or on behalf of the Tribe.States that: (1) the Secretary shall treat all applications to take land into trust within the boundaries of the original 1857 reservation as an on-reservation trust acquisition; and (2) all real property taken into trust within these boundaries before or after the date of the enactment of this Act shall be part of the Tribe's reservation.","[{'label': '[no-conn]', 'score': 0.20649346709251404}, {'label': 'further,', 'score': 0.3416474163532257}]"
"Energy Technology Transfer Act - Directs the Secretary of Energy to award competitive grants to Cooperative Extension services or offices, states, local governments, institutions of higher education, and nonprofit institutions with expertise in energy research to transfer knowledge about advanced energy technologies that increase efficient energy use to individuals, businesses, nonprofit entities, and public entities, including local governments and school districts.Requires an eligible grant applicant already to: (1) operate an outreach program capable of transferring such knowledge; or (2) partner with an entity that has such an outreach program.Authorizes the Secretary and the National Laboratories to provide grantees with technical assistance on advanced energy technologies and methods.","[{'label': 'specifically,', 'score': 0.4073528051376343}, {'label': 'specifically,', 'score': 0.22867842018604279}, {'label': '[no-conn]', 'score': 0.366355836391449}]"
"Safe Prescription Drug Disposal and Education Act - Amends the Controlled Substances Act to permit, for purposes of carrying out the grant program established by this Act for drug disposal units: (1) an ultimate user (or an authorized agent of the ultimate user) who has lawfully obtained a controlled substance to deliver such substance, without being registered, to another person for disposal; and (2) such person to receive such substance for disposal, without being registered.Authorizes the Attorney General to make grants to an eligible entity (i.e., a state, local government, local educational agency, Indian tribe, a federal, state, or local governmental agency, corporation, community coalition, or any combination of such entities) to: (1) establish and operate prescription drug disposal units for disposal of unneeded or expired prescription drugs; and (2) design and implement educational programs on the abuse of prescription drugs and on household items that may be used to cause perception, emotion, or behavior similar to that caused by the use of psychotropic drugs.Directs the Director of National Drug Control Policy to carry out a public education and outreach campaign to increase awareness of how ultimate users may lawfully and safely dispose of prescription drugs, including controlled substances, through drug take-back programs.","[{'label': 'specifically,', 'score': 0.8148280382156372}, {'label': 'NAN', 'score': 'NAN'}, {'label': 'specifically,', 'score': 0.44507768750190735}]"
"No Frills Prison Act - Amends the Violent Crime Control and Law Enforcement Act of 1994 to require a State, to be eligible for truth in sentencing incentive grants, to demonstrate that it: (1) provides living conditions and opportunities within its prisons that are not more luxurious than those that the average prisoner would have experienced if not incarcerated; (2) does not provide to any such prisoner specified benefits or privileges, including earned good time credits, less than 40 hours a week of work that either offsets or reduces the expenses of keeping the prisoner or provides resources toward restitution of victims, unmonitored phone calls (with exceptions), in-cell television viewing, possession of pornographic materials, instruction or training equipment for any martial art or bodybuilding or weightlifting equipment, or dress or hygiene other than as is uniform or standard in the prison; and (3) in the case of a prisoner serving a sentence for a crime of violence which resulted in serious bodily injury to another, does not provide housing other than in separate cell blocks intended for violent prisoners, less than nine hours a day of physical labor (with exceptions), any release from the prison for any purpose unless under physical or mechanical restraint, any viewing of television, any inter-prison travel for competitive sports, more than one hour a day spent in sports or exercise, or possession of personal property exceeding 75 pounds in total weight or that cannot be stowed in a standard size U.S. military issue duffel bag. Directs the Attorney General to establish similar conditions in the Federal prison system.","[{'label': 'NAN', 'score': 'NAN'}, {'label': 'further,', 'score': 0.1169847697019577}]"
Budget Integrity Act This bill amends the Congressional Budget Act of 1974 to require the Congressional Budget Office (CBO) to prepare long-term cost estimates for reported legislation with a gross budgetary impact of at least 0.25% of gross domestic product in either of the next two 10-year periods. The bill also creates a point of order against considering legislation in the House or the Senate that would cause a net increase in on-budget deficits above $5 billion in either of the two periods. The CBO and the Office of Management and Budget must issue long-term budget projections that cover 40 years. The Government Accountability Office must report on the effects of long-term debt. The bill amends the Rules of the House of Representatives to deem the House to have passed any necessary changes to the statutory debt limit upon adoption of the budget resolution. ,"[{'label': 'specifically,', 'score': 0.5451403260231018}, {'label': 'specifically,', 'score': 0.3637542724609375}, {'label': 'separately,', 'score': 0.06166132539510727}, {'label': 'thirdly,', 'score': 0.16942644119262695}, {'label': 'further,', 'score': 0.1300254464149475}]"
"Beach Protection Act of 2007 - Amends the Federal Water Pollution Control Act (popularly known as the Clean Water Act) to include among eligible grant activities the development and implementation of programs for source tracking, sanitary surveys, and prevention efforts to address the identified sources of beach water pollution. Authorizes appropriations for such grants for FY2007-FY2012.Requires grant recipients to identify: (1) the use of a rapid testing method; (2) measures for communication within 24 hours of the results of a water sample concerning pollutants to specified officials and all state agencies with authority to require the prevention or treatment of the sources of beach water pollution; (3) measures to develop and implement a beach water pollution source identification and tracking program for the coastal recreation waters that are not meeting applicable water quality standards for pathogens; (4) a publicly accessible and searchable global information system database with information updated within 24 hours of its availability, organized by beach and with defined standards, sampling plan, monitoring protocols, sampling results, and number and cause of beach closing and advisory days; and (5) measures to ensure that closures or advisories are made or issued within 24 hours after a state government determines that its coastal recreation waters are not meeting applicable water quality standards for pathogens.Sets forth provisions requiring: (1) a review by the Environmental Protection Agency (EPA) Administrator of state and local compliance with statutory and regulatory requirements and grant conditions; (2) corrective actions by such governments not in compliance; and (3) a review by the Comptroller General such compliance review and corrective action.Amends the Beaches Environmental Assessment and Coastal Health Act of 2000 to authorize appropriations to carry out such Act through FY2012.","[{'label': 'specifically,', 'score': 0.4739755690097809}, {'label': 'NAN', 'score': 'NAN'}, {'label': 'additionally', 'score': 0.23191605508327484}, {'label': 'accordingly', 'score': 0.18041495978832245}]"
"Public Research in the Public Interest Act of 2006 - Requires, as a condition of receiving federal assistance, any institution of higher education or research that conceives, reduces to practice, or holds title in a subject invention to grant irrevocable, perpetual, nonexclusive licenses to the invention and associated rights to any party requesting such a license pursuant to this Act. Provides that licenses shall be issued for: (1) supplying medical products to countries with low-income or lower-middle income economies; or (2) conducting neglected research anywhere, royalty-free. Provides that such licenses shall be part of the institution's title in a subject invention. Makes a license under this Act irrevocable and perpetual so long as the licensee submits to the licensor payment of a fair royalty on sales of any medical product within 90 days.Deems a party as automatically receiving the license requested upon submitting the required information to the Food and Drug Administration (FDA). Sets forth procedures for objections to the grant of a requested license.Requires the holder of title or any license in a subject invention to notify the FDA of any grant or license of rights in that invention.","[{'label': 'further,', 'score': 0.2959136366844177}, {'label': '[no-conn]', 'score': 0.568683385848999}, {'label': 'accordingly', 'score': 0.2180492877960205}, {'label': 'further,', 'score': 0.1408841609954834}, {'label': 'generally,', 'score': 0.11813415586948395}, {'label': 'specifically,', 'score': 0.14289362728595734}, {'label': 'further,', 'score': 0.25814342498779297}]"
