summary_clean,summary_tag
"Freedom from Government Competition Act of 2009 - Requires each executive or military department or independent establishment to obtain all goods and services necessary for or beneficial to the accomplishment of its authorized functions by procurement from private sources, except if: (1) such goods or services are required by law to be produced or performed by such agency; or (2) the head of the agency determines and certifies that federal production or performance is necessary for the national defense or homeland security, that a good or service is so inherently governmental in nature that it is in the public interest to require production or performance by government employees, or that there is no private source capable of providing the good or service.Requires such private sector provision of goods and services to be performed through: (1) the divestiture of federal involvement; (2) the award of a contract using competitive procedures; (3) converting an activity to performance by a qualified firm under at least 51% ownership by an Indian tribe or a Native Hawaiian Organization; or (4) conducting a public-private competitive sourcing analysis in accordance with Office of Management and Budget (OMB) procedures and determining that using the private sector is in the best interest of the United States and provides the best value to the taxpayer.Authorizes an agency head to utilize federal employees to provide goods or services previously provided by a private sector entity upon completion of a public-private competitive sourcing analysis and after determining that provision by federal employees provides the best value.Requires the Director to carry out a study, in conjunction with the Comptroller General, to evaluate the activities carried out in each agency.","[{'label': 'NAN', 'score': 'NAN'}, {'label': 'NAN', 'score': 'NAN'}, {'label': 'specifically,', 'score': 0.22613650560379028}, {'label': 'further,', 'score': 0.1828303039073944}]"
"TABLE OF CONTENTS: Title I: Federal Juvenile Proceedings Title II: Grant Program for at Risk Juveniles Juvenile Crime Avoidance and Prevention Act of 1996 - Title I: Federal Juvenile Proceedings - Amends the Federal criminal code to require an appropriate Federal authority (designated by the Attorney General), before any decision is made to proceed against a juvenile as a juvenile or as an adult, or to refer the juvenile to State authorities, to perform an initial intake screening to determine whether that juvenile is an at risk juvenile. Requires a juvenile who is determined to be at risk and who is proceeded against as a juvenile to be referred to a youth development specialist. Provides that if a juvenile is referred to State authorities for further proceedings or transferred for prosecution as an adult, the results of the screening shall be made available to those authorities or to the entity to which the juvenile is so transferred. Requires the screening body to determine that a juvenile is at risk if it determines that the juvenile is likely to exhibit recidivist or increasingly violent crimes, based on specified factors. Limits the use of such determination. Sets forth provisions regarding: (1) the qualifications and duties of the youth development specialist, including determining a course of action for the juvenile that will avoid continued criminal activity and monitoring the juvenile's progress through the court system; and (2) data collection and dissemination by the Attorney General. Title II: Grant Program for At Risk Juveniles - Directs the Attorney General to award: (1) grants to an entity that has implemented specified at risk juvenile screening programs and youth development specialist referral services; and (2) not more than $10,000 each year for each juvenile that receives services to an entity that meets the requirements of this title. Sets forth provisions regarding: (1) eligibility; and (2) permissible uses of grant funds. Authorizes appropriations. Specifies that funds authorized may be appropriated from the Violent Crime Reduction Trust Fund.","[{'label': 'NAN', 'score': 'NAN'}, {'label': 'additionally', 'score': 0.40172359347343445}, {'label': 'further,', 'score': 0.3592100441455841}, {'label': 'specifically,', 'score': 0.3694494664669037}, {'label': 'generally,', 'score': 0.3017007112503052}, {'label': 'additionally', 'score': 0.2796524465084076}, {'label': 'specifically,', 'score': 0.29274874925613403}, {'label': 'specifically,', 'score': 0.6396942734718323}, {'label': '[no-conn]', 'score': 0.08570857346057892}, {'label': 'additionally', 'score': 0.36903172731399536}]"
"Pine River Indian Irrigation Project Act of 2009 - Directs the Secretary of the Interior to study the irrigation infrastructure of the Pine River Indian Irrigation Project, Colorado, and develop a list of activities that are recommended to be implemented over a 10-year period to repair, rehabilitate, or reconstruct that infrastructure.Requires the Secretary to prioritize activities based on: (1) a review of specified priority factors (i.e., threats to health and safety; the extent of disrepair and its effect on the ability of Project users to irrigate agricultural land; the extent to which infrastructure repair would provide an opportunity to conserve water; the economic and cultural impacts the disrepair has, and benefits the repair would have, on the Tribe; the opportunity to address water supply or environmental conflicts through repair; and overall benefits of the activity to efficient water operations on the land of the Tribe); (2) recommendations of the Tribe; and (3) a consideration of projected benefits on Project completion.Authorizes the Secretary to provide grants to, and enter into cooperative agreements with, the Tribe to repair, rehabilitate, reconstruct, or replace the Project's irrigation infrastructure. Prohibits such assistance from being used for on-farm improvements. Requires the Secretary, in providing assistance, to coordinate the activity with any work being conducted under the irrigation operations and maintenance program of the Bureau of Indian Affairs (BIA).Caps the federal share of the total cost at 75%, subject to a waiver or limitation on the nonfederal share, at the Tribe's request.","[{'label': 'specifically,', 'score': 0.5313904881477356}, {'label': 'NAN', 'score': 'NAN'}, {'label': 'additionally', 'score': 0.2727322578430176}, {'label': '[no-conn]', 'score': 0.10306470841169357}, {'label': '[no-conn]', 'score': 0.12640254199504852}]"
"Sets forth requirements for: (1) agency payments to day laborers for excessive processing time; (2) civil damages and criminal penalties for certain employer violations; (3) itemized wage statements, annual earnings summaries, and optional payment schedules; (4) no charges for cashing wage payment checks or for overpayments; (5) nondiscrimination; (6) adequate seating, restrooms and water in waiting areas; (7) no restrictions on worker acceptance of permanent positions, but allowance placement fees paid to agencies by employers; (8) health care liability for injuries on the job or in transit; (9) agency notices, including employer lists and descriptions of jobs, wages, and other working conditions; (10) equitable expenses for day laborer meals, transportation, and equipment; (11) agency registration with the Secretary of Labor; and (12) Department of Labor enforcement of this Act.Amends the National Labor Relations Act to make it an unfair labor practice for employers to offer and grant: (1) permanent replacement employee status or other employment preferences to individuals for performing bargaining unit work for the employer during a labor dispute; or (2) any employment preference based on an individual's being employed, or having indicated a willingness to be employed, during a labor dispute, over any employee who was there at dispute commencement, has exercised rights through the labor organization involved in the dispute, and is working for the employer, or has unconditionally offered to return to such work.","[{'label': 'NAN', 'score': 'NAN'}, {'label': 'NAN', 'score': 'NAN'}]"
"Infant Protection and Baby Switching Prevention Act of 2011 - Amends title XVIII (Medicare) of the Social Security Act to require certain hospitals reimbursed under Medicare, which also provide neonatal and infant care, to have in effect security procedures to reduce the likelihood of infant patient abduction and baby switching, including procedures for identifying all infant patients in the hospital in a manner that ensures that it will be evident if infants are missing. Establishes civil penalties for failure to have such security procedures in effect.Amends the federal criminal code to prohibit and establish criminal penalties for baby switching in hospitals.","[{'label': 'specifically,', 'score': 0.4880746304988861}, {'label': 'specifically,', 'score': 0.18656419217586517}, {'label': 'separately,', 'score': 0.21350891888141632}]"
"Jay S. Hammond Wilderness Act Designates approximately 2,600,000 acres of National Wilderness Preservation System land in the Lake Clark National Park and Preserve in Alaska as the &quot;Jay S. Hammond Wilderness Area.&quot; ","[{'label': '[no-conn]', 'score': 0.7409594058990479}]"
"Journey Through Hallowed Ground National Heritage Area Education and Tourism Act of 2007 - Establishes the Journey Through Hallowed Ground National Heritage Area which may consist of the 175-mile region following the Route 15 corridor and surrounding areas through Pennsylvania, Maryland, West Virginia, and Virginia.Designates the Journey Through Hallowed Ground Partnership as the management entity for the Area. Requires the membership on the Board of Trustees of the Partnership to be open to the public and to include representatives from a broad cross-section of individuals, agencies, organizations, states, and governments participating in the Area that will oversee the development of the management plan.Requires the Partnership to develop a management plan for the Area that presents strategies and recommendations for promoting tourism within the Area and for educating the public about the historic significance of the Area.Makes the Federal Advisory Committee Act inapplicable to the Board of Trustees.","[{'label': '[no-conn]', 'score': 0.2999066412448883}, {'label': '[no-conn]', 'score': 0.27488598227500916}, {'label': 'additionally', 'score': 0.17028331756591797}, {'label': 'specifically,', 'score': 0.3715190887451172}, {'label': 'accordingly', 'score': 0.41677147150039673}]"
"She Is Ready Act - Prohibits the Secretaries of the military departments (the Secretaries) from unduly delaying the assignment of female members of the Armed Forces to military occupational specialties, positions, and units because of the absence of a cadre or critical mass of female members available for such assignment. Requires the Secretary of Defense (DOD) to direct the Secretaries to open for assignment of women all positions in occupations that are open to female members in any unit of the Armed Forces. Requires the Secretary of Defense to direct: (1) the Secretaries to validate the gender-neutral occupational standards used by the Armed Forces for the purpose of ensuring that such standards: (1) are consistent with provisions requiring performance outcome-based standards for the successful accomplishment of the necessary and required specific tasks associated with the qualifications and duties performed; (2) accurately predict performance of actual, regular, and recurring duties of a military occupation; and (3) are applied equitably to measure individual capabilities. Requires the Secretary of Defense to: (1) direct the Secretaries to provide greater transparency of women in service implementation plans and ensure that a statement of administration policy is created to reflect the mission of the plan and its intent on responsibly opening all jobs, positions, and units to female members of the Armed Forces; (2) promptly respond whenever one of the Secretaries submits a notice of newly opened jobs, positions, or units to female members of the Armed Forces; and (3) ensure all closed positions and units are open to female members of the Armed Forces by January 1, 2016, consistent with the Joint Memorandum issued on January 24, 2013, regarding the elimination of the 1994 Direct Ground Combat Definition and Assignment Rule. Requires the Secretary of the Navy to provide Congress with information on: (1) what process and metrics were used to validate the physical standards applicable to members of the Navy and Marine Corps; and (2) Marine Corps research involving female members of the Marine Corps who volunteer for the Infantry Officers Course, the enlisted infantry training course, and the Ground Combat Element Experimental Task Force. Makes any female member of the Marine Corps who graduates from the enlisted infantry course eligible for assignment to an infantry occupational specialty. Requires: (1) the Secretary of the Army to permit female members of the Army to apply to Army Ranger School for leadership training opportunities, and (2) the Secretary of Defense to direct the Special Operations Command to submit to Congress the type of approach and methodology it will be using for the integration of women into the Special Operations Forces. Requires the Secretary of Defense to direct the Secretaries to take immediate steps to ensure that properly designed and fitted combat equipment is available and distributed to female members of the Armed Forces. Directs the Comptroller General to conduct a review of Services' Outreach and Recruitment Efforts gauged toward women representation in the officer corps.","[{'label': 'specifically,', 'score': 0.5962309837341309}, {'label': 'specifically,', 'score': 0.21472492814064026}, {'label': 'NAN', 'score': 'NAN'}, {'label': 'NAN', 'score': 'NAN'}, {'label': 'specifically,', 'score': 0.7588925957679749}, {'label': 'additionally', 'score': 0.4931831955909729}, {'label': 'specifically,', 'score': 0.2502599060535431}, {'label': 'specifically,', 'score': 0.3942292630672455}, {'label': 'specifically,', 'score': 0.21804508566856384}]"
"Indian Money Account Claim Satisfaction Act of 2003 - Establishes the Indian Money Account Claim Satisfaction Task Force: (1) to complete an analysis of records, data, and other historical information with regard to the conduct of an historical accounting submitted by the parties in the class action to the district court in January 2003 (Cobell v. Norton (No. 96cv01285, D.D.C.)); and (2) after such completion to hold meetings with representatives of the plaintiffs in the civil action, the Departments of Justice and of the Interior and any other parties that, in the discretion of the Task Force, are necessary to carryout out its duties.Requires the Task Force to develop appropriate methodologies or models to conduct an accounting to determine in current dollars the balances of: (1) all individual Indian money accounts opened in or after 1985; (2) all individual Indian money accounts opened on or after the enactment of a certain Act of June 24, 1938, regarding deposit, care, and investment of Indian moneys, and before 1985; and (3) all individual Indian money accounts opened before such enactment.Establishes the Indian Money Claims Tribunal to serve as arbitrator if an eligible individual elects to have the amount of the balance in the individual Indian money account determined through arbitration. Binds the individual and the United States to any determination made by the Tribunal.Requires payments made pursuant to this Act to be derived from the permanent judgment appropriation (commonly known as the Judgment Fund), without further appropriations.","[{'label': '[no-conn]', 'score': 0.26318007707595825}, {'label': 'thereafter,', 'score': 0.5091997981071472}, {'label': 'specifically,', 'score': 0.6602341532707214}, {'label': 'thereafter,', 'score': 0.1356797069311142}, {'label': 'further,', 'score': 0.21605917811393738}, {'label': 'accordingly', 'score': 0.3320206105709076}]"
"Worker's Freedom of Choice Act - Prohibits labor unions or employers subject to valid labor agreements from receiving, soliciting, or accepting payment of dues or fees not related to exclusive representation and core purposes, including collective bargaining, contract administration, and grievance adjustment (notwithstanding an exception under the National Labor Relations Act relating to union security agreements which require payment of union dues or fees as a condition of employment). Gives a right of civil action to employees who dispute the amount so collected by labor organizations. Requires employers to post notice of such prohibition against labor unions using dues or fees, which are collected as conditions of employment, for any activities not necessary to performing their duties of exclusive representation of employees in dealing with employers on labor-management issues (union duties).Amends the Labor-Management Reporting and Disclosure Act of 1959 to require every labor union to attribute and report expenses by function classification, verified by independent audit, in enough detail to allow its members to determine whether such expenses were necessary to perform such union duties. Requires disclosure under such Act to employees required to pay any union dues or fees under a union security agreement as well as to union members.Prohibits labor union retaliation or coercion against any employee for exercising any right granted or protected by this Act.","[{'label': 'specifically,', 'score': 0.26688703894615173}, {'label': 'specifically,', 'score': 0.13905754685401917}, {'label': 'NAN', 'score': 'NAN'}, {'label': 'further,', 'score': 0.24269890785217285}, {'label': 'specifically,', 'score': 0.19327877461910248}]"
"Worker Protection Warnings Act of 1993 - Amends the Occupational Safety and Health Act of 1970 to direct the Secretary of Labor to issue a final regulation establishing, as occupational safety and health standards, uniform warnings for personal protective equipment for occupational use. Requires such regulation to be issued within 12 months after enactment of this Act, meet certain conditions, and incorporate specified considerations. Preempts State and local law with respect to such standards.","[{'label': 'separately,', 'score': 0.1414279341697693}, {'label': 'accordingly', 'score': 0.2334543764591217}, {'label': 'accordingly', 'score': 0.1301291584968567}]"
"Military Personnel Financial Services Education Act of 2005 - Provides financial services and life insurance consumer education for members of the Armed Forces and their spouses, which shall be provided as a component of initial entry and recurring training. (Such training shall include information on financial services marketing practices that are particularly prevalent at a military installation and vicinity.)Provides financial services counseling for members of the Armed Forces, and upon request, for their spouses. Requires a full-time trained counselor at installations with at least 750 assigned personnel, and other counseling at smaller installations.Requires counselors to provide members or spouses with information on Servicemembers' Group Life Insurance when providing information on private sector life insurance. Prohibits E-1 through E-4 members to pay for private sector insurance through pay allotments without a written certification of counseling.","[{'label': '[no-conn]', 'score': 0.5078602433204651}, {'label': 'additionally', 'score': 0.380270391702652}, {'label': '[no-conn]', 'score': 0.3705303370952606}, {'label': '[no-conn]', 'score': 0.31887975335121155}, {'label': 'specifically,', 'score': 0.16072316467761993}]"
"Nurse Loan Forgiveness Act of 2007 - Amends the Higher Education Act of 1965 (HEA) to include, under HEA student loan forgiveness and cancellation programs, nurses who: (1) serve at least one calendar year in an approved health care facility or setting; or (2) have a Masters of Science in Nursing and are nursing instructors in a school of nursing.Limits the maximum amount of such loan repayment by the Secretary of Education to $2,000 after the first year of a nurse's employment, with incremental increases after the second through fourth years, up to $5,000 after the fifth year.","[{'label': 'specifically,', 'score': 0.6604238748550415}, {'label': 'thereafter,', 'score': 0.9181590676307678}]"
"Student Visa Reform Act - Amends the Immigration and Nationality Act to require that a person coming to study at a college, university, or language training program in the United States under a nonimmigrant student F-visa must attend an institution that is accredited by an accrediting agency recognized by the Secretary of Education.Authorizes the Secretary of Homeland Security (DHS) to require academic institutions (exempts seminaries or other religious institutions) to be similarly accredited for F-visa purposes if: (1) the institution is not already required to be accredited, (2) an accrediting agency recognized by the Secretary of Education is able to provide such accreditation, and (3) 25 or more F-visa foreign students are or will be pursuing a course of study at the institution.Authorizes the Secretary of Homeland Security to waive the accreditation requirement for an established college, university, or language training program that is otherwise in compliance with F-visa provisions and is making a good faith effort to satisfy the accreditation requirement. Prohibits a person convicted of certain felony offenses, including human trafficking or visa fraud relating to an academic institution's participation in the Student and Exchange Visitor Program (SEVP), from having subsequent ownership or substantial authority at an academic institution participating in SEVP.Provides a three-year exemption for students coming to study at a college or university that has been certified by the Secretary of Homeland Security but not yet accredited or denied accreditation by an accrediting agency.","[{'label': 'currently,', 'score': 0.3121623992919922}, {'label': 'specifically,', 'score': 0.4713478684425354}, {'label': 'further,', 'score': 0.18017472326755524}, {'label': 'NAN', 'score': 'NAN'}]"
"Free Market Energy Act of 2015 This bill amends the Federal Power Act to identify the elements of a distributed energy resource, including fuel cells, microgrids, and combined heat and power systems. Distributed energy resources shall have a general right of interconnection under the Public Utility Regulatory Policies Act of 1978 (PURPA), and all rates and fees for interconnection shall provide for the two-way benefit for the distributed energy resource and the electricity grid. Each state regulatory authority shall consider requiring that distributed energy resources be eligible to receive just and reasonable energy and rate treatment for time-of-use pricing and other specified features and values. A state regulatory authority or nonregulated electric utility acting under state authority must consider specified interconnections standards that include: setting rates that exceed the incremental cost of alternative electric energy for purchases from any distributed energy resource that is a qualifying facility for electricity generated, demand reduced, or service provided by the qualifying facility interconnected under this Act; and making any distributed energy resource project exempt from filing requirements with the Federal Energy Regulatory Commission (FERC). A state regulatory authority must also consider: designation, through a competitive process, of a regulated utility, other party, or a combination of regulated utilities and other parties to be a smart grid coordinator or distribution system operator for the state; and nontransmission alternatives when a regulated utility proposes transmission projects. ","[{'label': 'specifically,', 'score': 0.7876054048538208}, {'label': 'further,', 'score': 0.38168951869010925}, {'label': 'additionally', 'score': 0.25682532787323}, {'label': 'NAN', 'score': 'NAN'}, {'label': '[no-conn]', 'score': 0.2627117931842804}]"
"Social Security Family Protection Act - Amends title II (Old Age, Survivors and Disability Insurance) (OASDI) of the Social Security Act to provide that, if an OASDI recipient dies during the first 15 days of a month, the OASDI benefit for that month shall be reduced by 50 percent.","[{'label': 'specifically,', 'score': 0.3274025022983551}]"
"Health Care Safety Net Amendments Technical Corrections Act of 2003 - Amends the Public Health Service Act and the Health Care Safety Net Amendments of 2002 to make technical and conforming amendments respecting: (1) health centers; (2) rural health outreach; (3) telehealth; (4) mental health services via telehealth; (5) health professional shortage areas; and (6) National Health Service Corps personnel, scholarships, and loan repayment.Authorizes grants to State professional licensing boards for State cooperation to reduce statutory and regulatory barriers to telemedicine.","[{'label': 'specifically,', 'score': 0.8604835271835327}, {'label': 'further,', 'score': 0.11820622533559799}]"
